{
  "id": "COA-PIPE-RUN-001",
  "matter_id": "MTR-001",
  "artifact_type": "COA_ELEMENT_COVERAGE",
  "schema_version": "1.0.0",
  "case_type": "civil",
  "coa_name": "breach_of_contract",
  "element_name": "breach",
  "coverage_status": "supported",
  "support_refs": [
    "EVT-PIPE-RUN-001",
    "FCT-PIPE-RUN-001"
  ],
  "run_id": "RUN-PIPELINE-001",
  "created_at": "2026-03-19T15:03:00Z"
}